{
  "$schema": "https://json-schema.org/draft/2020-12/schema",
  "$id": "https://openverification.dev/schemas/verification.bundle.schema.json",
  "title": "Verification Evidence Bundle",
  "type": "object",
  "required": ["bundle_id", "schema_version", "subject", "evidence", "decision"],
  "properties": {
    "bundle_id": { "type": "string" },
    "schema_version": { "type": "string" },
    "subject": {
      "type": "object",
      "required": ["repo", "head_sha"],
      "properties": {
        "repo": { "type": "string" },
        "pull_request": { "type": ["integer", "string"] },
        "base_sha": { "type": "string" },
        "head_sha": { "type": "string" }
      },
      "additionalProperties": true
    },
    "evidence": {
      "type": "array",
      "items": { "$ref": "verification.evidence.schema.json" }
    },
    "open_obligations": {
      "type": "array",
      "items": { "type": "object", "additionalProperties": true }
    },
    "decision": {
      "type": "object",
      "required": ["merge_recommendation"],
      "properties": {
        "decision_state": {
          "type": "string",
          "enum": ["allow", "block", "needs_review", "unknown", "error", "skipped"]
        },
        "original_decision_state": {
          "type": "string",
          "enum": ["allow", "block", "needs_review", "unknown", "error", "skipped"]
        },
        "merge_recommendation": {
          "type": "string",
          "enum": ["allow", "block", "require_human_review", "allow_with_warning", "require_stronger_check"]
        },
        "controlling_finding_ids": {
          "type": "array",
          "items": { "type": "string" }
        },
        "reason": { "type": "string" }
      },
      "additionalProperties": true
    },
    "attestation": {
      "type": "object",
      "properties": {
        "predicate_type": { "type": "string" },
        "content_addressed": { "type": "boolean" }
      },
      "additionalProperties": true
    }
  },
  "additionalProperties": true
}
